{
  "schemaVersion": 1,
  "dataVersion": "2026.08.1",
  "source": {
    "legacyRepository": "KiYouJyo/UrbanPlanToolbox",
    "legacyPath": "Assets/Data/RegulationsIndex/regulations-index.v1.json",
    "legacyCommit": "dcad5b1923ba96bf825904d024a3b13af5e615da",
    "sourceName": "中日美欧建筑规划法规索引.xlsx",
    "sourceVerifiedDate": "2026-07-31",
    "legacyDataVersion": 1,
    "legacyGeneratedAt": "2026-07-31T00:00:00Z"
  },
  "entries": [
    {
      "id": 1,
      "stableId": "reg-0001",
      "region": "中国",
      "jurisdictionLevel": "国家",
      "topic": "建筑与工程",
      "documentLevel": "法律",
      "originalTitle": "中华人民共和国建筑法",
      "chineseTitle": "中华人民共和国建筑法",
      "identifierOrYear": null,
      "scopeAndPurpose": "建筑活动、施工许可、发承包、监理、质量安全",
      "effectOrAdoption": "全国性法律；以官方现行文本为准",
      "officialUrl": "https://flk.npc.gov.cn/",
      "downloadUrl": "https://flk.npc.gov.cn/",
      "downloadAndCopyrightNote": "在国家法律法规数据库检索标题，可下载PDF/Word或查看历史版本",
      "verifiedDate": "2026-07-31",
      "searchKeywords": "中华人民共和国建筑法"
    },
    {
      "id": 2,
      "stableId": "reg-0002",
      "region": "中国",
      "jurisdictionLevel": "国家",
      "topic": "城乡规划",
      "documentLevel": "法律",
      "originalTitle": "中华人民共和国城乡规划法",
      "chineseTitle": "中华人民共和国城乡规划法",
      "identifierOrYear": null,
      "scopeAndPurpose": "城镇体系、城市镇村规划、规划许可与监督",
      "effectOrAdoption": "全国性法律；以官方现行文本为准",
      "officialUrl": "https://flk.npc.gov.cn/",
      "downloadUrl": "https://flk.npc.gov.cn/",
      "downloadAndCopyrightNote": "在国家法律法规数据库检索标题，可下载PDF/Word或查看历史版本",
      "verifiedDate": "2026-07-31",
      "searchKeywords": "中华人民共和国城乡规划法"
    },
    {
      "id": 3,
      "stableId": "reg-0003",
      "region": "中国",
      "jurisdictionLevel": "国家",
      "topic": "土地与用途管制",
      "documentLevel": "法律",
      "originalTitle": "中华人民共和国土地管理法",
      "chineseTitle": "中华人民共和国土地管理法",
      "identifierOrYear": null,
      "scopeAndPurpose": "土地所有、用途管制、征收、建设用地",
      "effectOrAdoption": "全国性法律；以官方现行文本为准",
      "officialUrl": "https://flk.npc.gov.cn/",
      "downloadUrl": "https://flk.npc.gov.cn/",
      "downloadAndCopyrightNote": "在国家法律法规数据库检索标题，可下载PDF/Word或查看历史版本",
      "verifiedDate": "2026-07-31",
      "searchKeywords": "中华人民共和国土地管理法"
    },
    {
      "id": 4,
      "stableId": "reg-0004",
      "region": "中国",
      "jurisdictionLevel": "国家",
      "topic": "房地产",
      "documentLevel": "法律",
      "originalTitle": "中华人民共和国城市房地产管理法",
      "chineseTitle": "中华人民共和国城市房地产管理法",
      "identifierOrYear": null,
      "scopeAndPurpose": "房地产开发用地、交易和登记",
      "effectOrAdoption": "全国性法律；以官方现行文本为准",
      "officialUrl": "https://flk.npc.gov.cn/",
      "downloadUrl": "https://flk.npc.gov.cn/",
      "downloadAndCopyrightNote": "在国家法律法规数据库检索标题，可下载PDF/Word或查看历史版本",
      "verifiedDate": "2026-07-31",
      "searchKeywords": "中华人民共和国城市房地产管理法"
    },
    {
      "id": 5,
      "stableId": "reg-0005",
      "region": "中国",
      "jurisdictionLevel": "国家",
      "topic": "工程合同与物权",
      "documentLevel": "法律",
      "originalTitle": "中华人民共和国民法典",
      "chineseTitle": "中华人民共和国民法典",
      "identifierOrYear": null,
      "scopeAndPurpose": "建设工程合同、物权、相邻关系、侵权责任",
      "effectOrAdoption": "全国性法律；以官方现行文本为准",
      "officialUrl": "https://flk.npc.gov.cn/",
      "downloadUrl": "https://flk.npc.gov.cn/",
      "downloadAndCopyrightNote": "在国家法律法规数据库检索标题，可下载PDF/Word或查看历史版本",
      "verifiedDate": "2026-07-31",
      "searchKeywords": "中华人民共和国民法典"
    },
    {
      "id": 6,
      "stableId": "reg-0006",
      "region": "中国",
      "jurisdictionLevel": "国家",
      "topic": "施工安全",
      "documentLevel": "法律",
      "originalTitle": "中华人民共和国安全生产法",
      "chineseTitle": "中华人民共和国安全生产法",
      "identifierOrYear": null,
      "scopeAndPurpose": "建设施工等生产经营活动安全责任",
      "effectOrAdoption": "全国性法律；以官方现行文本为准",
      "officialUrl": "https://flk.npc.gov.cn/",
      "downloadUrl": "https://flk.npc.gov.cn/",
      "downloadAndCopyrightNote": "在国家法律法规数据库检索标题，可下载PDF/Word或查看历史版本",
      "verifiedDate": "2026-07-31",
      "searchKeywords": "中华人民共和国安全生产法"
    },
    {
      "id": 7,
      "stableId": "reg-0007",
      "region": "中国",
      "jurisdictionLevel": "国家",
      "topic": "消防",
      "documentLevel": "法律",
      "originalTitle": "中华人民共和国消防法",
      "chineseTitle": "中华人民共和国消防法",
      "identifierOrYear": null,
      "scopeAndPurpose": "建设工程消防设计审查验收与消防安全",
      "effectOrAdoption": "全国性法律；以官方现行文本为准",
      "officialUrl": "https://flk.npc.gov.cn/",
      "downloadUrl": "https://flk.npc.gov.cn/",
      "downloadAndCopyrightNote": "在国家法律法规数据库检索标题，可下载PDF/Word或查看历史版本",
      "verifiedDate": "2026-07-31",
      "searchKeywords": "中华人民共和国消防法"
    },
    {
      "id": 8,
      "stableId": "reg-0008",
      "region": "中国",
      "jurisdictionLevel": "国家",
      "topic": "抗震防灾",
      "documentLevel": "法律",
      "originalTitle": "中华人民共和国防震减灾法",
      "chineseTitle": "中华人民共和国防震减灾法",
      "identifierOrYear": null,
      "scopeAndPurpose": "抗震设防、监测预报、应急救援",
      "effectOrAdoption": "全国性法律；以官方现行文本为准",
      "officialUrl": "https://flk.npc.gov.cn/",
      "downloadUrl": "https://flk.npc.gov.cn/",
      "downloadAndCopyrightNote": "在国家法律法规数据库检索标题，可下载PDF/Word或查看历史版本",
      "verifiedDate": "2026-07-31",
      "searchKeywords": "中华人民共和国防震减灾法"
    },
    {
      "id": 9,
      "stableId": "reg-0009",
      "region": "中国",
      "jurisdictionLevel": "国家",
      "topic": "建筑节能",
      "documentLevel": "法律",
      "originalTitle": "中华人民共和国节约能源法",
      "chineseTitle": "中华人民共和国节约能源法",
      "identifierOrYear": null,
      "scopeAndPurpose": "建筑节能与公共机构节能上位法",
      "effectOrAdoption": "全国性法律；以官方现行文本为准",
      "officialUrl": "https://flk.npc.gov.cn/",
      "downloadUrl": "https://flk.npc.gov.cn/",
      "downloadAndCopyrightNote": "在国家法律法规数据库检索标题，可下载PDF/Word或查看历史版本",
      "verifiedDate": "2026-07-31",
      "searchKeywords": "中华人民共和国节约能源法"
    },
    {
      "id": 10,
      "stableId": "reg-0010",
      "region": "中国",
      "jurisdictionLevel": "国家",
      "topic": "无障碍",
      "documentLevel": "法律",
      "originalTitle": "中华人民共和国无障碍环境建设法",
      "chineseTitle": "中华人民共和国无障碍环境建设法",
      "identifierOrYear": null,
      "scopeAndPurpose": "设施、信息和社会服务无障碍",
      "effectOrAdoption": "全国性法律；以官方现行文本为准",
      "officialUrl": "https://flk.npc.gov.cn/",
      "downloadUrl": "https://flk.npc.gov.cn/",
      "downloadAndCopyrightNote": "在国家法律法规数据库检索标题，可下载PDF/Word或查看历史版本",
      "verifiedDate": "2026-07-31",
      "searchKeywords": "中华人民共和国无障碍环境建设法"
    },
    {
      "id": 11,
      "stableId": "reg-0011",
      "region": "中国",
      "jurisdictionLevel": "国家",
      "topic": "环境评价",
      "documentLevel": "法律",
      "originalTitle": "中华人民共和国环境影响评价法",
      "chineseTitle": "中华人民共和国环境影响评价法",
      "identifierOrYear": null,
      "scopeAndPurpose": "建设项目和规划环境影响评价",
      "effectOrAdoption": "全国性法律；以官方现行文本为准",
      "officialUrl": "https://flk.npc.gov.cn/",
      "downloadUrl": "https://flk.npc.gov.cn/",
      "downloadAndCopyrightNote": "在国家法律法规数据库检索标题，可下载PDF/Word或查看历史版本",
      "verifiedDate": "2026-07-31",
      "searchKeywords": "中华人民共和国环境影响评价法"
    },
    {
      "id": 12,
      "stableId": "reg-0012",
      "region": "中国",
      "jurisdictionLevel": "国家",
      "topic": "环境保护",
      "documentLevel": "法律",
      "originalTitle": "中华人民共和国环境保护法",
      "chineseTitle": "中华人民共和国环境保护法",
      "identifierOrYear": null,
      "scopeAndPurpose": "建设活动环境保护基本制度",
      "effectOrAdoption": "全国性法律；以官方现行文本为准",
      "officialUrl": "https://flk.npc.gov.cn/",
      "downloadUrl": "https://flk.npc.gov.cn/",
      "downloadAndCopyrightNote": "在国家法律法规数据库检索标题，可下载PDF/Word或查看历史版本",
      "verifiedDate": "2026-07-31",
      "searchKeywords": "中华人民共和国环境保护法"
    },
    {
      "id": 13,
      "stableId": "reg-0013",
      "region": "中国",
      "jurisdictionLevel": "国家",
      "topic": "招标投标",
      "documentLevel": "法律",
      "originalTitle": "中华人民共和国招标投标法",
      "chineseTitle": "中华人民共和国招标投标法",
      "identifierOrYear": null,
      "scopeAndPurpose": "工程建设项目招标投标",
      "effectOrAdoption": "全国性法律；以官方现行文本为准",
      "officialUrl": "https://flk.npc.gov.cn/",
      "downloadUrl": "https://flk.npc.gov.cn/",
      "downloadAndCopyrightNote": "在国家法律法规数据库检索标题，可下载PDF/Word或查看历史版本",
      "verifiedDate": "2026-07-31",
      "searchKeywords": "中华人民共和国招标投标法"
    },
    {
      "id": 14,
      "stableId": "reg-0014",
      "region": "中国",
      "jurisdictionLevel": "国家",
      "topic": "政府采购",
      "documentLevel": "法律",
      "originalTitle": "中华人民共和国政府采购法",
      "chineseTitle": "中华人民共和国政府采购法",
      "identifierOrYear": null,
      "scopeAndPurpose": "政府投资项目采购活动",
      "effectOrAdoption": "全国性法律；以官方现行文本为准",
      "officialUrl": "https://flk.npc.gov.cn/",
      "downloadUrl": "https://flk.npc.gov.cn/",
      "downloadAndCopyrightNote": "在国家法律法规数据库检索标题，可下载PDF/Word或查看历史版本",
      "verifiedDate": "2026-07-31",
      "searchKeywords": "中华人民共和国政府采购法"
    },
    {
      "id": 15,
      "stableId": "reg-0015",
      "region": "中国",
      "jurisdictionLevel": "国家",
      "topic": "历史文化保护",
      "documentLevel": "法律",
      "originalTitle": "中华人民共和国文物保护法",
      "chineseTitle": "中华人民共和国文物保护法",
      "identifierOrYear": null,
      "scopeAndPurpose": "不可移动文物、历史建筑相关保护",
      "effectOrAdoption": "全国性法律；以官方现行文本为准",
      "officialUrl": "https://flk.npc.gov.cn/",
      "downloadUrl": "https://flk.npc.gov.cn/",
      "downloadAndCopyrightNote": "在国家法律法规数据库检索标题，可下载PDF/Word或查看历史版本",
      "verifiedDate": "2026-07-31",
      "searchKeywords": "中华人民共和国文物保护法"
    },
    {
      "id": 16,
      "stableId": "reg-0016",
      "region": "中国",
      "jurisdictionLevel": "国家",
      "topic": "乡村规划",
      "documentLevel": "法律",
      "originalTitle": "中华人民共和国乡村振兴促进法",
      "chineseTitle": "中华人民共和国乡村振兴促进法",
      "identifierOrYear": null,
      "scopeAndPurpose": "乡村建设、村庄规划和人居环境",
      "effectOrAdoption": "全国性法律；以官方现行文本为准",
      "officialUrl": "https://flk.npc.gov.cn/",
      "downloadUrl": "https://flk.npc.gov.cn/",